"#property","latitude","longitude","prefCode","identification","pref","city","name","fullNameInKana","fullNameInRomaji","address","katagaki","installer","telephoneNumber","extensionNumber","ssid","area","referenceObject","note"
"1","34.352575","134.0470042","37201",,"香川県","高松市","サンポート高松",,,"香川県高松市サンポート2番1号",,,,,"KAGAWA-WiFi_Takamatsu","高松シンボルタワー（市民ギャラリー、コミュニケーションプラザ、オープンホワイエ、オリーブタワー、展示場（ホール棟1階）、デックスガレリア）、高松シンボルタワー西側歩行者専用道路、高松駅、高松駅前広場、高松駅前バスターミナル、大型テナント広場、多目的広場",,"1回あたりの接続時間：30分（回数制限なし。ただし30分毎に再度認証が必要）"
"2","34.346049","134.050517","37201",,"香川県","高松市","高松中央商店街",,,"香川県高松市丸亀町1",,,,,"KAGAWA-WiFi_Takamatsu","高松中央商店街の街路（アーケード下）",,"1回あたりの接続時間：30分（回数制限なし。ただし30分毎に再度認証が必要）"
"6","34.34911337642227","134.05062987786422","37201",,"香川県","高松市","玉藻公園披雲閣",,,"香川県高松市玉藻町２番１号",,,,,"KAGAWA-WiFi",,,
"7","34.42222463856056","134.05413144104674","37201",,"香川県","高松市","男木交流館",,,"香川県高松市男木町１９８６番地",,,,,"KAGAWA-WiFi",,,
"8","34.38949764744894","134.05238501219824","37201",,"香川県","高松市","鬼ヶ島おにの館",,,"香川県高松市女木町１５番地２２",,,,,"KAGAWA-WiFi",,,
"9","34.17037598630636","134.08232722876988","37201",,"香川県","高松市","塩江インフォメーションセンター",,,"香川県高松市塩江町安原上東３９０−９",,,,,"KAGAWA-WiFi",,,
"10","34.40944181761771","134.10690956498806","37201",,"香川県","高松市","眉山亭",,,"香川県高松市庵治町６０３４",,,,,"KAGAWA-WiFi",,,
"11","34.35903506013678","134.1021938648672","37201",,"香川県","高松市","屋島山上時計案内板",,,"香川県高松市屋島東町",,,,,"KAGAWA-WiFi",,,
