"業務種別","施設名称１","施設郵便番号","施設所在地１","施設所在地２","施設電話番号","申請者名","申請者役職名","申請者代表者名","申請者都道府県名称","申請者住所１","申請者住所２","許可番号","許可日","営業の種別"
"公衆浴場業","あじ温泉　庵治観光ホテル　海のやどり","761-0130","高松市庵治町５４９４番地",,,"瀬戸内海観光株式会社","代表取締役","金井　眞智子","香川県","高松市庵治町５４９４番地",,"第182号","S39.04.06","その他の公衆浴場"
"公衆浴場業","いとより温泉","760-0012","高松市瀬戸内町３−１６",,"087-851-8943","有限会社　いとより温泉","取締役","野口　一二三","香川県","高松市瀬戸内町３−１６",,"第211号","S44.11.10","一般公衆浴場"
"公衆浴場業","秘書コレクション　高松店","760-0054","高松市常磐町二丁目５−１８",,"087-834-2561","有限会社南國商事","取締役","西川　泰勲","香川県","高松市常磐町二丁目５番地１８",,"第244号","S48.03.03","その他の公衆浴場"
"公衆浴場業","塩の江新温泉","761-1612","高松市塩江町安原上東２７８番地２",,"087-893-0246","株式会社　塩江新温泉ホテル","代表取締役","橘　澄夫","香川県","高松市塩江町安原上東２７８−２",,"第246号","S48.03.19","その他の公衆浴場"
"公衆浴場業","石庭","760-0036","高松市城東町二丁目７番４号",,"087-822-2662","有限会社　鎌倉観光","取締役","酒井　宣子","香川県","高松市城東町二丁目７番４号",,"第260号","S51.07.31","その他の公衆浴場"
"公衆浴場業","えびす湯","760-0013","高松市扇町一丁目２１−４",,"087-821-3303","辰馬　繁信",,,,,,"第275号","S53.06.05","一般公衆浴場"
"公衆浴場業","ハイパーリゾートヴィラ塩江","761-1614","高松市塩江町上西乙688番地1",,"087-893-1111","ハイパーリゾート株式会社","代表取締役","八木　裕幸","香川県","高松市塩江町上西乙688番地1",,"第301号","S58.04.08","その他の公衆浴場"
"公衆浴場業","吉野湯","760-0036","高松市城東町一丁目２番１０号",,"087-851-2592","有限会社　吉野湯","取締役","山本　和雄","香川県","高松市城東町一丁目２番１０号",,"第317号","S61.06.26","一般公衆浴場"
"公衆浴場業","新樺川観光ホテル","761-1612","高松市塩江町安原上東１番地６",,"087-893-1200","株式会社　新樺川","代表取締役","橘　澄夫","香川県","高松市塩江町安原上東１番地６",,"第318号","S61.07.22","その他の公衆浴場"
"公衆浴場業","さぬき温泉","761-1612","高松市塩江町安原上東２０６５−１",,"087-893-0300","株式会社　渡辺電工","代表取締役","渡辺　弘之","香川県","高松市香川町大野６９３−１",,"第332号","H01.04.19","その他の公衆浴場"
"公衆浴場業","ニューサウナゴールデンタイム","760-0052","高松市瓦町二丁目１番地５，６，７，２１",,"087-833-1234","有限会社　ニューサウナゴールデンタイム","代表取締役","深田　初王","香川県","高松市瓦町二丁目１番地７","クィーンズスクエアー第３ビル５階","第342号","H02.06.25","その他の公衆浴場"
"公衆浴場業","株式会社ヤマウチ　瀬戸内スイミングスクール香川校","761-1701","高松市香川町大野１７０−５",,"087-888-4341","株式会社ヤマウチ","代表取締役","岡本　将","香川県","高松市田村町３９７番地",,"第347号","H03.03.25","その他の公衆浴場"
"公衆浴場業","椿温泉","761-8047","高松市岡本町５２７番地１",,"087-885-2828","社会福祉法人香東園","理事長","石川　憲","香川県","高松市岡本町５２７番地１",,"第348号","H03.10.28","その他の公衆浴場"
"公衆浴場業","江戸城","760-0036","高松市城東町二丁目８番１４号",,"087-822-2800","有限会社　一光観光","代表取締役","栗永　秀夫","香川県","高松市城東町二丁目８番１４号",,"第357号","H05.02.22","その他の公衆浴場"
"公衆浴場業","鮎滝カントリークラブ浴場","761-1707","高松市香川町東谷２５９番地１",,"087-897-1111","宇高国道フェリー株式会社","代表取締役","加藤　琢二","香川県","高松市北浜町１番１号",,"第368号","H07.07.28","その他の公衆浴場"
"公衆浴場業","スーパー銭湯　あかね温泉","760-0002","高松市茜町２８番４３号",,"087-833-0268","有限会社新英興産","代表取締役","鈴木　英敬","香川県","高松市茜町２０番１４号",,"第375号","H09.09.12","一般公衆浴場"
"公衆浴場業","香川県立総合水泳プール","761-8042","高松市御厩町１５８５−１",,,"香川県教育委員会","教育長","淀谷　圭三郎","香川県","高松市番町四丁目１番１０号",,"第377号","H11.03.31","その他の公衆浴場"
"公衆浴場業","高松市ふれあい福祉センター　勝賀","761-8014","高松市香西南町４７６−１",,"087-882-6950","高松市長",,"大西　秀人","香川県","高松市番町１丁目８番１５号",,"第11001号","H11.04.14","その他の公衆浴場"
"公衆浴場業","フィットネスクラブ　レフコゆめタウン高松店","761-8056","高松市上天神町２６６番地",,"087-864-6210","株式会社レフコ","代表取締役","池田　孝道","香川県","丸亀市田村町１２３８番地",,"第11005号","H12.08.28","その他の公衆浴場"
"公衆浴場業","梅の湯","761-8063","高松市花ノ宮町三丁目２番７号",,"087-866-9793","有限会社　梅新","代表取締役","髙木　勝美","香川県","高松市花ノ宮町三丁目２番７号",,"第11006号","H12.09.28","一般公衆浴場"
"公衆浴場業","屋島カントリークラブ","761-0122","高松市牟礼町大町２５０８番地",,"087-845-3111","株式会社　チェリーゴルフ屋島","代表取締役","島津　崇","香川県","高松市牟礼町大町２５０８番地",,"第4号","H13.01.05","その他の公衆浴場"
"公衆浴場業","坊城温泉らら","761-0301","高松市林町２５７１−２",,"087-841-1000","光繁興業株式会社","代表取締役","伊賀　万佐子","香川県","高松市春日町１７４４番地４",,"第11008号","H13.04.06","一般公衆浴場"
"公衆浴場業","香川県営相撲場　シャワー室","761-8002","高松市生島町６１４","香川県総合運動公園内","087-881-0354","香川県知事",,"池田　豊人","香川県","高松市番町４丁目１−１０",,"第11009号","H13.08.24","その他の公衆浴場"
"公衆浴場業","サラマンダー","760-0017","高松市番町一丁目１０番１６号",,"087-863-3377","一般財団法人　三宅医学研究所","代表理事","三宅　信一郎","香川県","高松市番町一丁目１０番１６号",,"第11010号","H13.11.06","その他の公衆浴場"
"公衆浴場業","かざし温泉","769-0103","高松市国分寺町福家甲９９３番地６",,"087-874-7102","有限会社　松本","代表取締役","松本　宏道","香川県","高松市国分寺町福家甲９９５番地１",,"第89号","H13.11.22","その他の公衆浴場"
"公衆浴場業","高松クレーターの湯　天然温泉　きらら","761-8084","高松市一宮町８００番地１",,"087-815-6622","株式会社　きらら","代表取締役","植松　恵美子","香川県","高松市一宮町２２８番地１",,"第11011号","H13.12.12","その他の公衆浴場"
"公衆浴場業","アルファシティ屋島六番館展望家族風呂","761-0113","高松市屋島西町字飛石２２７４−２０",,,"穴吹興産株式会社","代表取締役","穴吹　忠嗣","香川県","高松市鍛冶屋町７番地１２",,"第11012号","H14.03.29","その他の公衆浴場"
"公衆浴場業","三十六温泉　由良里の湯","761-0441","高松市由良町４３−１",,"087-848-5126","有限会社　いち華","代表取締役","茂木　美奈子","香川県","高松市由良町４３番地１",,"第11014号","H14.07.30","一般公衆浴場"
"公衆浴場業","香川県立武道館　浴室","760-0066","高松市福岡町１−５−５","香川県立武道館内","087-821-5125","香川県知事",,"池田　豊人","香川県","高松市番町４丁目１−１０",,"第11018号","H15.05.09","その他の公衆浴場"
"公衆浴場業","岩盤浴天照","760-0062","高松市塩屋町１１番１５","２階","087-822-4007","有限会社　丸善美容商事","代表取締役","山内　澄子","香川県","高松市番町三丁目２０番６号",,"第11025号","H17.03.01","その他の公衆浴場"
"公衆浴場業","仏生山温泉　天平湯","761-8079","高松市仏生山町乙１１４−５",,"087-889-7750","有限会社観翠旅館","代表取締役","岡　昇平","香川県","高松市仏生山町乙１１０番地２",,"第11032号","H17.11.22","その他の公衆浴場"
"公衆浴場業","ザ・ココナツウエルネスクラブ高松","761-0301","高松市林町２０１８−１",,"087-868-7756","株式会社南海スポーツ企画","代表取締役","岩崎　吉典","愛媛県","松山市古三津六丁目５番２３号",,"第11042号","H18.03.23","その他の公衆浴場"
"公衆浴場業","一郎の湯（ハイ・フォロー・高松東）","761-0103","高松市新田町乙８番地","１F","087-818-0778","株式会社Ｔ・Ｐ","代表取締役","寺河　駿","香川県","高松市新田町乙８番地",,"第11045号","H18.05.23","その他の公衆浴場"
"公衆浴場業","ジョイフィット２４ 高松","761-8056","高松市上天神町５１０−１",,"087-867-3636","株式会社ヤマウチ","代表取締役","岡本　将","香川県","高松市田村町３９７番地",,"第11047号","H18.08.14","その他の公衆浴場"
"公衆浴場業","ゴールデンタイム高松／瓦町ぎおん温泉","760-0052","高松市瓦町２−１−７",,"087-897-3177","株式会社ワイ・ワイ・カンパニー","代表取締役","吉原　龍生","香川県","高松市瓦町二丁目１番地７",,"第5220002号","H20.05.12","その他の公衆浴場"
"公衆浴場業","香南楽湯","761-1404","高松市香南町横井９９７番地２",,"087-815-8585","株式会社　創裕","代表取締役","川北　祐一郎","香川県","高松市朝日新町１７番１５号",,"第5220006号","H21.04.01","その他の公衆浴場"
"公衆浴場業","四国高松温泉　ニューグランデみまつ","760-0046","高松市通町２−３",,"087-851-3507","株式会社三松","代表取締役","金井　優典","香川県","高松市通町２番地の３",,"第5221002号","H21.05.26","その他の公衆浴場"
"公衆浴場業","アパホテル＜高松空港＞　空港温泉","761-1402","高松市香南町由佐２４２５−５",,"087-879-1111","アパホテル株式会社","代表取締役","元谷　芙美子","東京都","港区赤坂三丁目２番３号",,"第5221003号","H21.07.08","その他の公衆浴場"
"公衆浴場業","ＢＩＴＥＫＩ　ＬＡＮＤ　ＬＥＧＥＮＤ","760-0036","高松市城東町二丁目６番１号","第２宮本ビル","087-813-0987","株式会社ＳＥＤＯＮＡ企画","代表取締役","壷内　岳人","香川県","高松市城東町二丁目６番１号",,"第5222001号","H22.06.25","その他の公衆浴場"
"公衆浴場業","自然家","761-0442","高松市川島本町４９７−１",,"087-887-6222","林　奈智子",,,,,,"第5222003号","H22.09.01","その他の公衆浴場"
"公衆浴場業","たかの友梨ビューティクリニック高松店","760-0029","高松市丸亀町１３番３号",,"087-851-4107","株式会社不二ビューティ","代表取締役","髙野　友梨","東京都","港区南青山二丁目１２番１２号",,"第5222005号","H23.03.09","その他の公衆浴場"
"公衆浴場業","ファーストイン高松","760-0035","高松市鶴屋町２番３号",,"087-822-1919","株式会社　昌栄","代表取締役","金　昌淑","香川県","高松市鶴屋町２番３号",,"第5222006号","H23.03.17","その他の公衆浴場"
"公衆浴場業","しらゆき姫","760-0036","高松市城東町二丁目９番１３号",,"087-822-5546","有限会社チャレンジ","取締役","𦚰　峻士","香川県","高松市城東町二丁目９番１３号",,"第5222007号","H23.03.18","その他の公衆浴場"
"公衆浴場業","高松市亀水運動センター　亀水荘","761-8001","高松市亀水町４５８番地１",,"087-881-0182","公益財団法人高松市スポーツ協会","代表理事","大西　努","香川県","高松市福岡町四丁目３６番１号",,"第5223002号","H23.05.27","その他の公衆浴場"
"公衆浴場業","高松市かわなべスポーツセンターかわなべ荘","761-8046","高松市川部町９３２番地７",,"087-885-4611","公益財団法人高松市スポーツ協会","代表理事","大西　努","香川県","高松市福岡町四丁目３６番１号",,"第5223003号","H23.05.27","その他の公衆浴場"
"公衆浴場業","はくちょう温泉","769-0104","高松市国分寺町新名２２１３番地１",,"087-874-8900","公益財団法人高松市スポーツ協会","代表理事","大西　努","香川県","高松市福岡町四丁目３６番１号",,"第5223004号","H23.05.30","その他の公衆浴場"
"公衆浴場業","ＲＡＯ","760-0036","高松市城東町二丁目１０番２３号",,"087-821-2311","株式会社天","代表取締役","矢野　孝典","香川県","高松市城東町二丁目１０番２３号",,"第5223005号","H24.01.10","その他の公衆浴場"
"公衆浴場業","ホテル　セカンドステージ","761-1614","高松市塩江町上西乙１１１８−８",,"087-893-1100","株式会社しおのえ","代表取締役","喜多　維昭","香川県","高松市塩江町安原上７６１番地１",,"第5223006号","H24.03.27","その他の公衆浴場"
"公衆浴場業","クア温泉屋島","761-0104","高松市高松町字明神２１８７−１",,"087-814-3378","齋藤　正人",,,,,,"第5224005号","H24.10.15","一般公衆浴場"
"公衆浴場業","ジャパンスイミングスクール","760-0001","高松市新北町２８−１２",,"087-833-2433","株式会社ジャパンスイミングスクール","代表取締役","清水　一伸","香川県","高松市新北町１９番３４号",,"第50001号","H25.03.08","その他の公衆浴場"
"公衆浴場業","花樹海温泉　海と昴の湯","760-0004","高松市西宝町３−５−１０",,"087-861-5580","株式会社喜代美山荘","代表取締役","三矢　昌洋","香川県","高松市西宝町三丁目５番１０号",,"第50003号","H25.04.16","その他の公衆浴場"
"公衆浴場業","ラ・プラージュ","760-0036","高松市城東町二丁目１０番２５号",,"087-822-5656","有限会社モリコ","取締役","泉谷　あおい","香川県","高松市城東町二丁目１０番２５号",,"第50005号","H26.03.11","その他の公衆浴場"
"公衆浴場業","トレビの泉は城東町１番の高級ソープ","760-0036","高松市城東町二丁目１０番１号","１階、３階、４階","087-811-7260","株式会社泉州商会","代表取締役","上田　幸大","香川県","高松市城東町二丁目１０番１号",,"第50007号","H26.08.26","その他の公衆浴場"
"公衆浴場業","クラブＪ１","760-0036","高松市城東町２−１０−２６",,"087-821-3024","ライズ株式会社","代表取締役","山方　真一","香川県","高松市城東町二丁目１０番２６号",,"第50008号","H27.02.13","その他の公衆浴場"
"公衆浴場業","ブルーム館　高松","760-0052","高松市瓦町２−２−２７",,"087-834-5151","株式会社　彩さ美","代表取締役","篠森　京子","愛媛県","松山市南江戸三丁目３番１６号",,"第50009号","H27.07.06","その他の公衆浴場"
"公衆浴場業","貝温泉　実の里","761-1613","高松市塩江町上西甲１２７−１",,"087-893-1877","有限会社完土","代表取締役","完土　勇","香川県","高松市十川東町９３８番地１",,"第50012号","H27.10.15","その他の公衆浴場"
"公衆浴場業","金瓶梅　城東町で一番人気のあるお店","760-0036","高松市城東町二丁目８番９号",,"087-821-4617","株式会社ＰＬＵＭ","代表取締役","弓山　秀和","香川県","高松市城東町二丁目８番９号",,"第50013号","H27.10.28","その他の公衆浴場"
"公衆浴場業","ページボーイ","760-0050","高松市亀井町３−３","谷原不動産ビル２Ｆ","087-813-1710","株式会社ページボーイ","代表取締役","後藤　美佳","香川県","高松市亀井町３−３","谷原不動産ビル２階","第50014号","H27.12.28","その他の公衆浴場"
"公衆浴場業","Ｔｉ　Ａｍｏ（ティアモ）","760-0036","高松市城東町２−７−７",,"087-811-2266","株式会社オフィスパラダイス","代表取締役","谷本　哲夫","香川県","高松市城東町二丁目７番７号",,"第50015号","H28.03.22","その他の公衆浴場"
"公衆浴場業","和楽","760-0036","高松市城東町２−８−１４",,"087-811-0855","株式会社　すえひろ","代表取締役","本村　剛","香川県","高松市松福町二丁目１３番７−７０１号","ラ・パルフェ・ド・コゼット","第50018号","H29.08.08","その他の公衆浴場"
"公衆浴場業","高松センチュリーホテル","760-0020","高松市錦町１−４−１９",,"087-851-0558","有限会社高松センチュリーホテル","代表取締役","十川　好信","香川県","高松市錦町一丁目４番１９号",,"第50020号","H30.06.28","その他の公衆浴場"
"公衆浴場業","ＴＨＥ　ＣＡＬＭ（ザ・カーム）","761-1705","高松市香川町川東下１８７８番地",,"087-879-3411","高松パレス株式会社","代表取締役","住田　浩","香川県","高松市香川町川東下１８７８番地",,"第50022号","R01.07.08","その他の公衆浴場"
"公衆浴場業","多恋人","760-0036","高松市城東町二丁目９番１５号",,"087-822-7081","名城観光株式会社","代表取締役","當野　真利","香川県","高松市城東町二丁目９番１５号",,"第50023号","R01.07.24","その他の公衆浴場"
"公衆浴場業","健康増進温浴施設","761-1503","高松市塩江町安原下第３号２０７４番地２",,"087-897-0781","シンコースポーツ四国株式会社","代表取締役","石崎　健太","香川県","高松市寿町一丁目１番１２号",,"第50025号","R02.07.06","その他の公衆浴場"
"公衆浴場業","高松ぽかぽか温泉","761-8076","高松市多肥上町１５１５番地",,"087-888-1126","株式会社創裕","代表取締役","川北　祐一郎","香川県","高松市朝日新町１７番１５号",,"第50027号","R02.07.31","その他の公衆浴場"
"公衆浴場業","ｃｌｕｂ　ＩＳＭ","760-0036","高松市城東町２−１０−２０","Ｋ２ビル西側４階","087-811-7126","株式会社ＦＲＥＥＤＯＭ","代表取締役","利岡　竜也","香川県","高松市城東町二丁目１０番２０号",,"第50029号","R03.04.12","その他の公衆浴場"
"公衆浴場業","ＣＵＯＲＥ（クオレ）","760-0036","高松市城東町２丁目７番２１号",,"087-822-1107","株式会社エナジーシステムズ","代表取締役","日下　盛男","香川県","高松市城東町二丁目７番２１号",,"第50032号","R03.09.01","その他の公衆浴場"
"公衆浴場業","庵治ほっとぴあん","761-0130","高松市庵治町９７８",,"087-871-2534","株式会社オクト","代表取締役","増田　伊三雄","香川県","高松市庵治町６３９１番地１６３",,"第50033号","R03.10.01","その他の公衆浴場"
"公衆浴場業","さぬきの湯　ドーミーイン高松","760-0052","高松市瓦町１丁目１０−１０",,"087-832-5489","株式会社共立メンテナンス","代表取締役","中村　幸治","東京都","千代田区外神田二丁目１８番８号",,"第50034号","R03.11.02","その他の公衆浴場"
"公衆浴場業","ＲＶ　ＰＡＲＫ　ＫＵＭＯＮパーク","761-0450","高松市三谷町１４０４−１",,"087-880-2033","公文　健二",,,,,,"第50035号","R03.12.15","その他の公衆浴場"
"公衆浴場業","天然温泉玉藻の湯　ドーミーイン高松中央公園前","760-0018","高松市天神前１−３",,"087-835-5489","株式会社共立メンテナンス","代表取締役","中村　幸治","東京都","千代田区外神田二丁目１８番８号",,"第50036号","R03.12.17","その他の公衆浴場"
"公衆浴場業","アルファ","760-0036","高松市城東町二丁目６番１号","第２宮本ビル南２階、３階、４階","087-851-1877","株式会社アイエスアイ","代表取締役","藤川　雅靖","香川県","高松市高松町５２８番地１","シャンテル２０１","第50037号","R04.04.04","その他の公衆浴場"
"公衆浴場業","春日なごみの湯　湯楽温泉","760-0080","高松市木太町２７５０−３",,"087-833-2611","春日開発株式会社","代表取締役","遠藤　直樹","香川県","高松市木太町２７５０番地３",,"第50040号","R05.09.01","一般公衆浴場"
"公衆浴場業","Ｈｏｔ　Ｓｔｏｎｅ　Ｓｐａ　ＳＩＮ−ＯＮ","761-0441","高松市由良町４１番地",,"087-899-5787","三木　守",,,,,,"第50041号","R05.10.11","その他の公衆浴場"
"公衆浴場業","萌えラブスクール","760-0036","高松市城東町二丁目６番３号","ＬＡＶＥＳＳＯビル１階","087-821-3300","株式会社ワン","代表取締役","佐藤　敬太","香川県","高松市城東町二丁目６番３号","ＬＡＶＥＳＳＯビル１Ｆ","第50042号","R05.10.17","その他の公衆浴場"
"公衆浴場業","萌えラブスクール２","760-0036","高松市城東町二丁目６番３号","ＬＡＶＥＳＳＯビル２階","087-821-4400","株式会社ツー","代表取締役","佐藤　敬太","香川県","高松市城東町二丁目６番３号","ＬＡＶＥＳＳＯビル２Ｆ","第50043号","R05.12.07","その他の公衆浴場"
"公衆浴場業","萌えラブスクール３","760-0036","高松市城東町二丁目６番３号","ＬＡＶＥＳＳＯビル３階","087-821-4424","株式会社スリー","代表取締役","佐藤　敬太","香川県","高松市城東町二丁目６番３号","ＬＡＶＥＳＳＯビル３Ｆ","第50044号","R06.01.05","その他の公衆浴場"
"公衆浴場業","ｃｌｕｂ−１５１Ａ　２ｎｄ","760-0036","高松市城東町二丁目１０−２０","Ｋ２ビル　５Ｆ",,"エンカウンター株式会社","代表取締役","谷本　政樹","香川県","高松市城東町二丁目１０番２０号",,"第50046号","R06.07.16","その他の公衆浴場"
"公衆浴場業","ｃｌｕｂ−１５１Ａ","760-0036","高松市城東町二丁目１０−２０","Ｋ２ビル２・３Ｆ（西側）",,"エンカウンター株式会社","代表取締役","谷本　政樹","香川県","高松市城東町二丁目１０番２０号",,"第50045号","R06.07.16","その他の公衆浴場"
"公衆浴場業","ＷＡＭ　ＡＬＬ　ＡＴＨＬＥＴＥ　ＳＴＡＴＩＯＮ","761-1703","高松市香川町浅野９９８番地",,"087-879-1126","株式会社浅野企業","代表取締役","眞鍋　章司","香川県","高松市香川町浅野６２５番地１",,"第50047号","R06.07.29","その他の公衆浴場"
"公衆浴場業","ＴＨＥ・ＢＵＮＮＹ　高松店","760-0036","高松市城東町二丁目８番１６号","高松パラダイスビル１階，２階","087-821-5838","株式会社マルボロ","代表取締役","加古山　春佳","香川県","高松市城東町二丁目８番１６号",,"第50048号","R06.08.28","その他の公衆浴場"
